Placing,Horse No,Horse Name,Jockey,Gear,Comment,Date,RaceNumber
8,4,CLUB ACE  (J523),B Avdulla,TT,"Sat on pace, traveled okay, responded only fairly when placed under pressure (See Incident Report).",2025-03-12,3
9,12,LUCKY GENERATIONS  (J338),A Badel,P/H2/TT,"Settled behind midfield, traveled fairly, slightly hung out making the Turn, limited response when asked.",2025-03-12,3
10,11,RACINGRACE  (J102),M F Poon,XB,"Sat midfield, raced wide, weakened passing 200M.",2025-03-12,3
11,5,RUN YES RUN  (J264),M Chadwick,B-,"Settled worse than midfield, no impression made (See Incident Report).",2025-03-12,3
12,8,IRON LEGION  (J459),B Thompson,B/TT,"Ridden along to lead, raced tight near 250M, weakened notably thereafter (Fractious in the barriers, Must stalls test).",2025-03-12,3
1,1,FIND MY LOVE  (H110),H Bowman,B/TT-,"Mid-field. Headway from 200m out and ran on strongly to lead late on, winning cosily.",2025-03-12,4
2,7,NEBRASKAN  (J304),A Badel,B1,Across from outside draw to track leader. Led 150m out. Pressed by winner final 75m and passed late on.,2025-03-12,4
3,12,TRIUMPHANT WARRIOR  (H430),K Teetan,TT,"Held up from high draw. Ran on well final 200m, getting up for third close home.",2025-03-12,4
4,2,BOWSER  (H460),M Chadwick,TT,Tracked pace. Every chance from 200m out. Stayed on without being able to quicken.,2025-03-12,4
5,9,NEW POWER  (H325),M L Yeung,--,Prominent early. Chased leading pair into home straight and challenged at 150m line. No extra after very briefly crowded 50m out.,2025-03-12,4
6,4,GOLDEN FRIENDSHIP  (K106),L Ferraris,CP1/TT,Fast start and led. Joined at 200m line and faded final 100m.,2025-03-12,4
7,3,LUCKY ARCHANGEL  (E385),M F Poon,B,In rear after crowded at start. Pushed along bend. Some late headway down the outside but never a threat to leaders.,2025-03-12,4
8,8,GLORY CLOUD  (H320),B Avdulla,TT,Headway mid-race to race in touch with leaders. Unable to sustain effort and lost ground final 100m.,2025-03-12,4
9,5,TELECOM DRAGON  (H322),A Atzeni,CP1/TT,In rear after crowded at start. Some headway off bend but one paced and no real impression.,2025-03-12,4
10,10,KA YING POWER  (H169),L Hewitson,H/SR,Mid-field. Pushed along 300m out and unable to quicken. Weakened final 100m.,2025-03-12,4
11,6,CHILL MASTER  (J319),J Orman,TT,Keen early towards rear. Headway up rail on bend. Unable to sustain and weakened over 150m out.,2025-03-12,4
12,11,THE DOUBLE EAGLE  (J342),H T Mo,B-/CP1,Struggling in rear and detached over 400m out. Well beaten.,2025-03-12,4
1,6,HIGHLAND RAHY  (J298),L Hewitson,B/TT,"Jumped well, sent forward to take the lead, enjoyed the easy lead in the middle stages, led by 1-1/4L turning in, kept on very well in straight and scored.",2025-03-12,5
2,1,VIVA GRACIOUSNESS  (J079),M Chadwick,TT,"Commenced well, raced in 2nd, a length behind the leader, easy run to turn, kept on well in straight but always held.",2025-03-12,5
3,2,THESIS  (H111),A Atzeni,TT,"Began well from gate 1, raced slightly better than midfield on the inside, saved ground on turn, closed off well to take a place without threatening the first two.",2025-03-12,5
4,7,FIREFOOT  (J183),J Orman,TT,"Jumped with them, positioned 2 wide, 2 lengths or so back, 3 wide from 450M, peaked early in straight, ran on evenly to the line.",2025-03-12,5
5,8,AMAZING AWARD  (J236),K Teetan,CP/TT,"Taken back from a wide draw, raced 2 wide behind midfield, steadied and shifted out near 1100M, commenced move approaching 450M, finished off evenly.",2025-03-12,5
6,4,THE AZURE  (J227),L Ferraris,--,"Moderately away, raced 3 wide slightly behind midfield, 2 wide after passing 1100M, found rail near 750M, commenced move 450M, showed limited response in straight, weakened close home.",2025-03-12,5
7,9,SMART CITY  (J213),M F Poon,CP/TT,"Taken back from a wide draw, raced towards rear on the outside, checked near 1100M, 8 lengths or so back on turn, made minor progress in straight. (Lame right front leg next day morning.)",2025-03-12,5
8,11,CONFRINGO  (J322),H Bentley,V/TT,"Slowly away, raced behind midfield on the inside, crowded near 1300M, 6 lengths or so back in the middle stages, saved ground throughout, showed limited response early in straight, weakened inside final furlong.",2025-03-12,5
9,3,CELESTIAL HARMONY  (K059),B Thompson,CP1,"Jumped awkwardly, raced 2 wide slightly better than midfield, very wide turning in, peaked early in straight, weakened inside final furlong.",2025-03-12,5
10,12,SUPER TREASURE  (J211),Y L Chung,CP-/B1,"Away with them, raced slightly behind midfield on the outside, peaked on turn, weakened early in straight.",2025-03-12,5
11,5,THE WAY WE WIN  (J493),E C W Wong,B/TT,"Taken back from the widest draw, raced at rear throughout, never a factor.",2025-03-12,5
DNF,10,INTREPID WINNER  (G144),D McDonogh,B,"Began well, raced 2 wide in midfield, went amiss and was retired from the race 1100M.",2025-03-12,5
1,10,TACTICAL COMMAND  (H197),A Badel,B,"Jumped well, settled in front of midfield, closed off strongly to score.",2025-03-12,6
2,9,GLORY B  (H373),L Hewitson,CP,"Tracked leader, kept on nicely.",2025-03-12,6
3,7,MR COOL  (K184),K Teetan,TT1,"Settled behind midfield 2 wide, stayed on late, closest finish.",2025-03-12,6
4,8,E UNIVERSE  (H151),K De Melo,TT,"Sat on pace on the rail, kept on until weakened slightly final 50M.",2025-03-12,6
5,2,GIANT LEAP  (J143),H Bowman,B,"Showed good early speed to lead, weakened final 150M",2025-03-12,6
6,4,VON BAER  (K198),B Thompson,--,"Sat towards the rear, stayed on fairly.",2025-03-12,6
7,1,FORTUNE WHISKEY  (J153),M F Poon,B/TT,"Not the quickest out, sat last, ran on ordinarily.",2025-03-12,6
8,11,RUN RUN TIMING  (H403),H Bentley,B/TT,"Settled midfield 3 wide, made little impression. (See Incident Report)",2025-03-12,6
9,3,KARATE EXPRESS  (J306),J Orman,--,"Settled midfield on the rail, only one pace when asked.",2025-03-12,6
10,12,SPICY SO SMART  (G203),M Chadwick,V/TT,"Caught 4 wide with cover behind midfield, never a threat.",2025-03-12,6
11,6,KING ALLOY  (K099),R Kingscote,--,"Crowded at the start, hard ridden to recover, caught wide and gave ground. (See Incident Report)",2025-03-12,6
12,5,CHAMPION METHOD  (H366),A Atzeni,B2/TT-,"Sat in front of midfield 3 wide, never a chance. (See Incident Report)",2025-03-12,6
1,7,HAPPY FAT CAT  (G166),A Hamelin,TT,"Broke well settling just off the pace in 2nd, hit the front from tiring pace-setter 150M out, just held on to the line.",2025-03-12,7
2,6,KING OF FIGHTERS  (K174),B Avdulla,TT,"Began moderately settling some 3L back in 5th, became some 5L 4th rounding home bend when tempo quickened, fought on dourly to reach 2nd late.",2025-03-12,7
3,11,CIRCUIT JOLLY  (J506),K Teetan,B,"Settled mainly just over 2L back in 3rd, slightly further back when race leader quickened into straight, kept on steadily for 3rd.",2025-03-12,7
4,2,EASON  (G061),H Bowman,--,"Settled well behind from a poor draw, saved ground on the rail turning in for home, ran on to be nearest at finish despite tight run in straight.",2025-03-12,7
5,4,PRINCE OF PORTY  (H009),M F Poon,TT,"Settled in midfield, kept on steadily under pressure in straight.",2025-03-12,7
6,1,YOUTHFUL SPIRITS  (J082),L Ferraris,SR/V/TT,"Soon took up running, kicked some 2L clear approaching home turn and flattered early in straight, headed when tiring 150M out.",2025-03-12,7
6,10,RUN RUN SMART  (K080),A Badel,TT,"Settled in last few, ran on under pressure past beaten runners inside final 200M.",2025-03-12,7
8,9,KING ECCELLENTE  (G264),H Bentley,B/XB,"Settled in midfield, ran home one-paced.",2025-03-12,7
9,3,ABSOLUTE HONOUR  (K260),Y L Chung,TT1,"Settled in 4th or 5th on rail to straight, dropped out under pressure.",2025-03-12,7
10,5,SEASONS WIT  (H223),J Orman,B/TT,"Settled wide in midfield without cover, kept on under pressure before fading inside final 100M.",2025-03-12,7
11,8,BLAZING WIND  (J157),A Atzeni,CP/TT,"Slowly away settling in last few, swung widest and last into straight, made no impression.",2025-03-12,7
1,5,BEAUTY INFINITY  (H377),B Avdulla,--,"Bumped at the start, travelled handily behind leaders, well placed to strike top of straight, quickened up nicely to take lead near 100M, kept on final stages to score.",2025-03-12,8
2,4,LUCKY EIGHT  (G204),C L Chau,--,"Obtained a midfield position 2-wide, travelled well into contention, finished off well to take 2nd near line.",2025-03-12,8
3,1,SPORTS LEGEND  (H456),H T Mo,B/TT,"Vied for the lead early stages, tracked leader on settling, moved up to press the pace again 400M, led 250M until headed near 100M, lost 2nd near line.",2025-03-12,8
4,10,YOUNG ARROW  (J401),H Bentley,XB-/CP,"Jumped awkwardly, restrained to race near last, driven wide into straight then closed off fairly well to claim 4th.",2025-03-12,8
5,6,SOLID CAR  (K058),K Teetan,--,"Taken back from wide draw, settled near last 5Ls away, plenty to do top of straight, ran home well but could not be ridden out closing stages when racing in restricted room.",2025-03-12,8
6,3,CHATEAUNEUF  (J219),H Bowman,B/TT,"Chased leaders on inside, raced in restricted room from 300M, steadied 100M and not ridden out over concluding stages.",2025-03-12,8
7,11,POSITIVE SMILE  (J467),M L Yeung,--,"Unhurried after the jump, near last early stages before improving to a position behind midfield, kept on fairly throughout final 300M. Posed little threat to leaders.",2025-03-12,8
8,8,EVERSTAR  (K264),M F Poon,CP1/TT-,"From draw 1 maintained a midfield position along the fence, fought on same pace turning home, never a serious threat to leaders.",2025-03-12,8
9,9,WRITTEN CASA  (J305),A Atzeni,B/TT,"Dropped back after the jump and eventually settled in last, 8Ls to make up 400M, ran past a couple of beaten rivals only. (Jockey: instructed to ride his mount in a conservative manner in the early stages.)",2025-03-12,8
10,7,MULTIDUTCH  (K171),Y L Chung,B/TT,"Jumped only fairly, settled down behind midfield, little change in position to the straight, didn't find much when asked, disappointed for clear running 200M but already out of contention.",2025-03-12,8
11,2,CALIFORNIA TOUCH  (J051),M Chadwick,TT,"Vied for early lead before emerging as leader 700M, under siege 300M, soon gave ground and weakened to last. (Trainer: not suited by a rival being positioned to its outside throughout the early and middle stages.)",2025-03-12,8
1,10,BEAUTY ALLIANCE  (J260),A Badel,--,"Bumped and unbalanced shortly after start, raced in 2nd, 2 wide, challenged the leader approaching 400M, took the lead 200M, kept on strongly to the line, won by 3-1/2L.",2025-03-12,9
2,6,FALLON  (H219),B Thompson,B/TT,"Moderately away from the widest draw, raced 2 wide in midfield, 4 lengths or so back, same margin back on turn, finished off well to take 2nd, no threat to the winner.",2025-03-12,9
3,11,NORTHERN BEAST  (H233),M F Poon,V,"Began smartly, sent forward to take the lead, led by a length, challenged by rival approaching 400M, peaked and headed 200M, weakened final 100M.",2025-03-12,9
4,9,JUMBO LEGEND  (G266),L Hewitson,H/TT,"Began awkwardly, raced 2 wide at rear, 9 lengths back, commenced move after passing 500M, very wide turning in, made very good progress in straight to make frame.",2025-03-12,9
5,4,STAR MAC  (J053),B Avdulla,B/TT,"Crowded start and unbalanced, positioned 2 wide, 7 lengths back, same margin back on turn, very wide into straight, made some progress in the run home.",2025-03-12,9
6,8,CHARITY GAIN  (H431),L Ferraris,XB/TT,"Crowded on jumping, raced 2 wide behind midfield, 6 lengths back, there to turn, made little progress in straight.",2025-03-12,9
7,2,ROMANTIC LAOS  (G476),C L Chau,CP/TT,"Began only fairly, raced 2 wide better than midfield, 3 lengths back, same position on turn, peaked early in straight, weakened in the closing stages.",2025-03-12,9
8,3,HAMERON  (H265),R Kingscote,--,"Began well from gate 1, raced in midfield on the inside, 4 lengths or so back, saved ground on turn, showed limited response early in straight, kept on same pace to the line.",2025-03-12,9
9,12,WINNING STEPS  (G420),K Teetan,H/PC,"Slightly slow out and crowded, raced towards rear on the inside, 8 lengths back turning in, made no impression in straight. (Lame right hind leg next day morning.)",2025-03-12,9
10,5,ALLCASH  (K190),A Hamelin,CP/TT,"Jumped well, raced better than midfield on the inside, 3 lengths back, saved ground on turn, peaked early in straight, weakened inside final furlong.",2025-03-12,9
11,7,SIMPLY MAVERICK  (H346),D McDonogh,V-,"Shifted out at start and bumped, raced behind midfield on the inside, saved ground on turn, failed to close off in straight.",2025-03-12,9
12,1,TALENTS AMBITION  (J136),A Atzeni,B/XB,"Taken back from a wide draw, raced at tail throughout, never a factor.",2025-03-12,9
Comments on Running is not available for this race.,Comments on Running is not available for this race.,Comments on Running is not available for this race.,Comments on Running is not available for this race.,Comments on Running is not available for this race.,Comments on Running is not available for this race.,2025-03-12,10
Comments on Running is not available for this race.,Comments on Running is not available for this race.,Comments on Running is not available for this race.,Comments on Running is not available for this race.,Comments on Running is not available for this race.,Comments on Running is not available for this race.,2025-03-12,11
Comments on Running is not available for this race.,Comments on Running is not available for this race.,Comments on Running is not available for this race.,Comments on Running is not available for this race.,Comments on Running is not available for this race.,Comments on Running is not available for this race.,2025-03-12,12
Comments on Running is not available for this race.,Comments on Running is not available for this race.,Comments on Running is not available for this race.,Comments on Running is not available for this race.,Comments on Running is not available for this race.,Comments on Running is not available for this race.,2025-03-12,13
1,5,WORLD HERO  (J413),L Ferraris,B,"Shifted in at start and bumped, sent forward to take the lead, travelled well in the middle stages, led by 3/4L turning in, kept on well to the line and scored. (See Racing Incidents.)",2025-03-15,1
2,2,FAIRY HORSE  (J144),H Bowman,SB/TT,"Moderately away from gate 1, positioned 3 lengths behind the leader on the inside, same position on turn, finished off well to take 2nd.",2025-03-15,1
3,10,SPEEDY SMARTIE  (H108),B Avdulla,CP/TT,"Away well, raced prominently, 2 wide on turn, kept on well in straight to take a place, always held.",2025-03-15,1
4,3,THE CONCENTRATION  (H465),J Orman,PC/TT,"Fast into stride, positioned 2 lengths behind the leader on the inside, saved ground on turn, finished off evenly.",2025-03-15,1
5,6,SUPER EAGLE  (G408),K Teetan,TT,"Jumped awkwardly, taken back to race towards rear on the inside, 5 lengths or so back turning in, no clear run early in straight, cleared 300M, finished off strongly to be nearest on line. (See Racing Incidents.)",2025-03-15,1
6,8,ALMIGHTY KICK  (J254),R Kingscote,XB,"Began only fairly, raced behind midfield on the inside, 4 lengths or so back, same margin back on turn, kept to inside after straightening and made some progress. (See Racing Incidents.)",2025-03-15,1
7,11,GALLANT GOODY  (H434),M F Poon,XB-,"Crowded shortly after start, raced 2 wide, 4 lengths or so back, there to turn, no daylight early in straight, made minor progress thereafter.",2025-03-15,1
8,12,TSUEN WAN GLORY  (E403),M Chadwick,TT,"Began awkwardly and unbalanced, positioned 3 wide, 2 lengths back, wider turning in, made some progress early in straight, peaked 200M, kept on same pace to the line.",2025-03-15,1
9,4,URBAN TRIUMPH  (H200),K C Leung,V/TT,"Made contact at start, raced in midfield on the outside, 4 lengths back turning in, peaked early in straight, ran on evenly to the line.",2025-03-15,1
10,9,DOUBLE BINGO  (J309),M L Yeung,H/P/TT,"Slowly away, raced at tail, 7 lengths back turning in, made no impression in straight.",2025-03-15,1
11,7,WINNING HEART  (H065),A Badel,B/TT,"Average to begin, sent forward to race prominently but trapped 3 wide, there to turn, peaked early in straight, weakened final 300M. (See Racing Incidents.)",2025-03-15,1
12,1,BULB EMPEROR  (J241),C L Chau,V1/TT,"Crowded start, raced 2 wide better than midfield, 2 lengths or so back turning in, weakened early in straight, eased final furlong. (Irregular heart rhythm.) (See Racing Incidents.)",2025-03-15,1
1,5,SOARING BRONCO  (J162),B Avdulla,PC/TT,A bit keen in mid-field. Headway from 300m out and led 100m out. Cosy at line.,2025-03-15,2
2,13,LEATHER MASTER  (H034),A Badel,V,Tracked pace. Led briefly before winner 150m out. Stayed on.,2025-03-15,2
3,4,SMASHING EXPRESS  (J252),A Hamelin,E-,Mid-field. Stayed on but lacked pace of first two.,2025-03-15,2
4,10,CASA LEGEND  (G126),M F Poon,P/TT,Rear of mid-field. Wide off final bend. Stayed on and never nearer.,2025-03-15,2
5,6,MANYTHANKS FOREVER  (J065),A Atzeni,TT,Tracked leading pair. Effort and every chance from top of home straight. No extra final 100m.,2025-03-15,2
6,7,IVICTORIAM  (J226),B Thompson,TT,Mid-field. Under pressure 400m out and lacked pace to challenge.,2025-03-15,2
7,1,CHILLI BABA  (G339),J Orman,B,Dropped in from wide draw and last into home straight. Angled wide and never on terms with leaders.,2025-03-15,2
8,9,SILVER DESTINY  (J096),M Chadwick,XB1/TT,Across to press leader from high draw. Ridden 300m out. Weakened final 200m.,2025-03-15,2
9,2,SMART BEAUTY  (G477),Y L Chung,B/H/TT,Held up and no real impression under pressure.,2025-03-15,2
10,11,CHATEAU LE PECHE  (H471),C L Chau,B,Mid-field. Unable to pick up for pressure and never a threat home straight.,2025-03-15,2
11,14,RED MAVERICK  (J067),M L Yeung,TT-,Led until headed 150m out. Faded. Reported to have bled.,2025-03-15,2
12,12,YOO YOO KNIGHT  (H053),H Bentley,CP/TT,Chased leading pair. Weakened 200m out.,2025-03-15,2
13,3,STRONGEST BOY  (H027),H Bowman,B2/TT,Held up from widest stall. Never dangerous.,2025-03-15,2
14,8,MR GOOD VIBES  (H180),K Teetan,V,Always towards rear. Struggling and lost touch 300m out. Eased.,2025-03-15,2
1,9,SUPER STRONG KID  (K180),M Chadwick,--,"Settled in front of midfield, switched in from 350M, made good progress when asked (Bled, Must BT).",2025-03-15,3
2,12,BINGO BABE  (K115),M F Poon,H1/XB1,"Settled midfield, traveled nicely, closed off strongly.",2025-03-15,3
3,11,NOBLE DELUXE  (K052),B Thompson,PC-/B1/TT,"Sat behind midfield, raced keenly in the middle stages, no clear run until 100M, not fully tested.",2025-03-15,3
4,7,HONEST WITNESS  (K283),K Teetan,--,"Jumped only fairly, sat handy, traveled okay, ran on evenly.",2025-03-15,3
5,1,CHEVAL VALIANT  (E336),P N Wong,B/TT,"Ridden hard to lead, weakened from 300M, closed off only fairly.",2025-03-15,3
6,2,THUNDER PRINCE  (K017),H Bowman,E/TT,"Jumped awkwardly, sat worse than midfield, obtained clear running near 150M, ran on okay.",2025-03-15,3
7,10,SAVVY TWINKLE  (K067),A Badel,XB1/TT,"Sat handy, crowded and checked close to the finish.",2025-03-15,3
8,5,GLACIATED  (K272),J Orman,--,"Jumped awkwardly, sat towards rear, minor progress made.",2025-03-15,3
9,3,ALLURING LAOS  (J478),E C W Wong,CP/TT,"Sat behind than midfield, no clear run approaching the 150M, not fully tested.",2025-03-15,3
10,13,SPICY KNUCKLES  (H463),A Hamelin,CP/TT,"Chased the leader, traveled one pace, weakened passing 250M.",2025-03-15,3
11,8,SUPER GOLDI  (H477),K C Leung,CP,"Settled midfield, limited response when asked.",2025-03-15,3
12,14,MACANESE MASTER  (J532),Y L Chung,B,"Settled behind midfield, traveled only fairly, not much impression made.",2025-03-15,3
13,6,GO GENERAL  (H330),K De Melo,CP1,"Jumped awkwardly, raced rear, raced greenly (Unacceptable racing manner, See Incident Report).",2025-03-15,3
14,4,SUMMIT CHEERS  (E221),B Avdulla,--,"Sat worse than midfield, weakened passing 300M, gave ground quickly (See Incident Report).",2025-03-15,3
1,2,CROSSBORDERPEGASUS  (K008),H Bowman,TT,"Tracked pace. Moved upsides leader going strongly 200m out. Got on top despite hanging right, winning with plenty in reserve.",2025-03-15,4
2,9,LUCKY SYMPHONY  (J089),A Atzeni,H/P/TT,Tracked pace. Moved to front 300m out. Unable to hold off strong-travelling winner but clear of rest.,2025-03-15,4
3,3,SUPER LOVE  (K118),K Teetan,--,Knuckled over leaving stalls and towards rear. Unable to reach first two but stayed on for third.,2025-03-15,4
4,11,SHINY RAPIDASH  (J492),C L Chau,H1/B2/TT,Made running. Headed 300m out. No extra and lost ground final 150m.,2025-03-15,4
5,4,HAPPY PARK  (J311),J Orman,XB2,Mid-field. Short of room against rail early part of home straight. One paced.,2025-03-15,4
6,6,DAZZLING FIT  (K298),L Ferraris,XB1,Held up. Ran green and short of room when trying to improve 150m out. Switched and finished with running left. Promising.,2025-03-15,4
7,5,DASH  (K250),L Hewitson,--,Mid-field. Chased leaders off bend but one paced and lost ground home straight.,2025-03-15,4
8,1,CIRCUIT DUFFY  (J501),K C Leung,--,Tracked leader. Ridden and weakened from 300m out.,2025-03-15,4
9,8,AMAZING GALAXY  (J238),R Kingscote,CP1,Raced wide in rear from high draw and keen. Some headway final 200m but never a threat.,2025-03-15,4
10,10,FLYING AKEED  (J471),P N Wong,B2,Mid-field. No impression under pressure from 300m out.,2025-03-15,4
11,12,TAIHANG SCENERY  (J314),H Bentley,H/TT,"Short of room in rear early. Wide off bend and never dangerous, again tight for room late on.",2025-03-15,4
12,7,SUPER SICARIO  (K306),A Badel,H/XB,Keen in rear after dropped in from wide draw. Struggled to go pace final 400m and lost touch.,2025-03-15,4
1,4,GOLD MASTER  (J389),A Atzeni,B,"Began well from gate 1, raced in midfield on the inside, saved ground on turn, no clear run early in straight, cleared 200M, finished off strongly to score.",2025-03-15,5
2,14,KASA PAPA  (G312),A Badel,TT,"Jumped with them, positioned 2 wide better than midfield, there to turn, showed good response in straight, hit the front approaching 200M, kept on well but unable to hold off the winner close home.",2025-03-15,5
3,7,ACE WAR  (J509),J Orman,XB-,"Out with rest, raced 3 wide with cover in midfield, angled out 500M, made good progress early in straight, peaked 150M, ran on evenly to the line.",2025-03-15,5
4,8,GOOD GOOD  (J224),B Avdulla,B,"Moderately away from a wide draw, sent forward to race in 2nd, 2 wide, 3/4L back in the middle stages, challenged the leader 500M, took the lead 400M, peaked and headed approaching 200M, weakened gradually final 50M.",2025-03-15,5
5,9,BRAVE WITNESS  (H425),K Teetan,P-/XB/TT,"Jumped with them, raced better than midfield on the inside, saved ground on turn, kept on same pace in straight.",2025-03-15,5
6,6,BRIGHT INHERITANCE  (J215),M F Poon,V-/B2/TT1,"Taken back from the widest draw, raced behind midfield on the inside, saved ground on turn, made little progress in straight.",2025-03-15,5
7,2,VOLCANIC SPARK  (H388),H Bowman,B,"Away with them, raced 3 wide behind midfield, angled out 450M, finished off evenly.",2025-03-15,5
8,11,YOUTH POWER  (H358),P N Wong,B-/CP1/TT,"Away well, raced 2 wide in midfield, there to turn, peaked early in straight, ran on evenly to the line.",2025-03-15,5
9,5,BEAUTY LIVE  (G057),Y L Chung,V-/TT,"Began well from a wide draw, raced 3 wide better than midfield, no cover throughout, peaked early in straight, weakened final furlong.",2025-03-15,5
10,1,JOYFUL PROSPERITY  (H213),L Ferraris,B/TT,"Began only fairly, raced 2 wide behind midfield, angled out 450M, one-paced in the run home.",2025-03-15,5
11,3,SERANGOON  (H296),H Bentley,CP/TT,"Jumped only fairly, raced at tail, 6 lengths or so back turning in, made no impression in straight.",2025-03-15,5
12,13,GLUCK RACER  (E157),B Thompson,B/H2,"Taken back to race 3 wide with cover towards rear, very wide into straight, made no impression in the run home.",2025-03-15,5
13,10,QUICK QUICK WIN  (K102),C L Chau,XB1/TT-,"Began well from a wide draw, sent forward to take the lead, led by 3/4L, challenged by rival from 500M, headed 400M, weakened thereafter.",2025-03-15,5
14,12,HEALTHY GOLF  (J424),L Hewitson,XB,"Taken back to race at rear on the inside, saved ground on turn, showed no response early in straight, weakened final furlong.",2025-03-15,5
1,9,MONARCH COUNTY  (J421),H Bowman,TT,"Jumped on terms, settled midfield 3 wide, closed off nicely to score.",2025-03-15,6
2,14,PEARL OF PANG'S  (J447),M F Poon,B/TT1,"Caught 3 wide no cover on pace, kept on nicely.",2025-03-15,6
3,3,GOOD LUCK BABE  (K016),A Atzeni,XB/TT,"Settled behind the leaders, ran on.",2025-03-15,6
4,6,HANDSOME BOMB  (H402),M Chadwick,CP/TT,"Jumped well and led, kept on fairly.",2025-03-15,6
5,10,VIEW ALL THINGS  (K101),M L Yeung,--,"Settled worse than midfield 2 wide, made some good late ground.",2025-03-15,6
6,11,DRAGON SUNRISE  (J269),L Hewitson,--,"Settled behind midfield 3 wide, ran on evenly.",2025-03-15,6
7,7,WIN SPEED  (J205),L Ferraris,B,"Settled in front of midfield, raced keenly, made little impression.",2025-03-15,6
8,1,FUN TOGETHER  (H041),P N Wong,CP/TT,"Sat outside the lead, weakened final 100M.",2025-03-15,6
9,8,EVERYONE'S CLASSIC  (J407),J Orman,TT,"Sat last, only able to pass weakened rivals.",2025-03-15,6
10,5,RUN RAN RUN  (J108),K C Leung,B/TT,"Sat behind the pace, never a threat. (See Incident Report)",2025-03-15,6
11,12,PANDA  (H466),B Thompson,CP/TT,"Sat towards the rear, under pressure from 650M, limited response.",2025-03-15,6
12,2,EXCEL WONGCHOY  (J194),K Teetan,H/TT,"Settled midfield on the rail, weakened final 250M. (See Incident Report) (Substantial blood)",2025-03-15,6
13,4,CONSPIRACY WITNESS  (J541),D McDonogh,--,"Settled behind midfield on the rail, never involved.",2025-03-15,6
14,13,PATCH OF LUCKY  (J349),R Kingscote,B/XB1/TT-,"Settled towards the rear, under heavy pressure from 700M, weakened and faded. (See Incident Report)",2025-03-15,6
