Placing,Horse No,Horse Name,Jockey,Gear,Comment,Date,RaceNumber
4,12,SO AWESOME  (D258),A Badel,B/TT,"Began well, sent forward to take the lead, led by a length turning in, kept on well early in straight, peaked and headed near 100M, weakened thereafter.",2025-04-20,1
5,13,HARRY'S HERO  (H332),K De Melo,--,"Taken back from a wide draw, raced at rear on the outside, found rail near 800M, 2 wide from 600M, 6 lengths back turning in, made good progress in straight to be nearest on line.",2025-04-20,1
6,14,YEABOI  (G372),M F Poon,TT,"Began only fairly, raced at rear, 7 lengths back turning in, made good progress in the run home, nearest finish.",2025-04-20,1
7,7,SUPER TREASURE  (J211),E C W Wong,B,"Crowded shortly after start, raced in 3rd, 1-1/2L behind the leader on the inside, saved ground on turn, kept on well early in straight, weakened final 100M.",2025-04-20,1
8,9,TRADITION  (J111),K Teetan,B,"Taken back from a wide draw, raced 2 wide towards rear, 7 lengths or so back, commenced move 550M, 5 to 6 lengths back turning in, showed limited response early in straight, weakened gradually inside final furlong.",2025-04-20,1
9,5,COLOURFUL BARON  (G301),J Orman,B/TT2,"Crowded start, raced in midfield on the outside, there to turn, peaked early in straight, weakened final furlong.",2025-04-20,1
10,4,THE PRIME  (J352),L Hewitson,TT,"Taken back from the widest draw, raced towards rear on the inside, saved ground on turn, peaked early in straight, weakened final furlong.",2025-04-20,1
11,11,SILVER DESTINY  (J096),M Chadwick,XB/TT,"Slightly slow out and crowded, positioned 2 wide, 4 lengths back, sent forward 750M, challenged the leader 550M, peaked 450M, weakened gradually in straight. (Roarer.)",2025-04-20,1
12,6,PERFECT PEACH  (E488),A Atzeni,B-/P2,"Moderately away from gate 1, raced in midfield on the inside, peaked 500M, weakened early in straight.",2025-04-20,1
13,3,EN PERFECTO  (J409),P N Wong,CP-/B1/TT,"Crowded shortly after start, raced 2 wide behind midfield, weakened after passing 500M, eased final furlong. (Irregular heart rhythm.)",2025-04-20,1
14,1,DECRELOT  (J551),M L Yeung,TT,"Taken back from gate 9, raced behind midfield on the outside, unable to maintain position after passing 600M, last turning in, emptied early in straight. (See Racing Incidents.)",2025-04-20,1
1,3,TOP DRAGON  (J481),Z Purton,TT1,"Settled down in midfield, went forward 600M swinging wide for home, quickened up impressively to lead inside 300M, soon kicked clear for easy victory.",2025-04-20,2
2,2,GALLANT EPOCH  (J451),L Hewitson,B/TT,"Bumped on jumping, went forward chasing the pace, all out for the lead early straight, couldn't match winner's pace inside 300M, ran on steadily final stages holding on for 2nd.",2025-04-20,2
3,8,JUBILANT WINNER  (J346),B Thompson,V/TT,"Jumped fairly, held up in mid-division 4-5Ls off pace, stayed on mildly final 400M without troubling the runaway winner, just lost out to runner-up at the line.",2025-04-20,2
4,6,GOLDEN LUCK  (H159),P N Wong,XB/TT,"Went forward vying for early lead, checked 800M by the race leader, in 3rd spot top of straight, kept on evenly over final 350M but not making ground on leaders.",2025-04-20,2
5,13,JOLLY JUMPER  (K110),A Badel,CP-/V1/TT,"Jumped awkwardly from draw 1, settled along the fence in the group chasing leaders, kept on moderately over final 400M, always held by leaders.",2025-04-20,2
6,7,FORTUNE STAR  (K003),L Ferraris,TT,"Restrained to race behind midfield, 5-6Ls off the pace middle stages, swung wide for home before running on mildly towards the line. (Jockey : raced greenly throughout.)",2025-04-20,2
7,11,STRATHPEFFER  (H095),J Orman,B,"Caught wide no cover chasing leaders, came under pressure 500M, lay in and finished the race off only fairly, soon out of contention.",2025-04-20,2
8,12,ARDEN  (J505),B Avdulla,PC-/B1/TT,"Jumped only fairly, maintained a position behind midfield, driven out top of straight but responded only fairly, held ground over final 300M.",2025-04-20,2
9,5,THUNDER BLINK  (J019),K C Leung,H-/V-/B1/TT,"Taken back to last on jumping from wide draw, 9Ls off the pace middle stages, moved closer 600M, responded fairly early straight and never reach leaders.",2025-04-20,2
10,14,SHINE BRIGHT  (H385),K Teetan,B,"From wide draw pressed forward, led from 1100M, struggled to hold its lead passing 400M, soon weakened out of contention.",2025-04-20,2
11,1,I P O BROS  (K193),M L Yeung,B1,"Dropped back to near last, got shuffled back to the rear 600M and had plenty to do on straightening, ran past beaten horses only.",2025-04-20,2
12,9,REGENCY WIN WIN  (K214),H Bentley,CP1/TT,"Bumped on jumping, stayed close enough to leaders, came under pressure 600M, couldn't finish off the race. (Jockey : raced greenly throughout.)",2025-04-20,2
13,10,SANDMAN  (K220),K De Melo,CP1/TT1,"Jumped only fairly, ended up racing near last, had big task in hand 400M, failed to run on.",2025-04-20,2
14,4,DREAMING WINNER  (K046),A Atzeni,H/TT,"Bumped at the start, obtained a 3-wide position in midfield, swung wide for home but had nothing to offer on straightening.",2025-04-20,2
1,1,SOLID SHALAA  (H228),E C W Wong,B/TT,"Jumped awkwardly, sat worse than midfield, traveled fairly well, responded nicely from the back.",2025-04-20,3
2,8,FUN N FUN TOGETHER  (J232),Z Purton,CP-/B1,"Shared the lead, traveled strongly, had every chance.",2025-04-20,3
3,11,ROBOT KNIGHT  (H464),K Teetan,TT,"Sat worse than midfield, traveled okay, made good ground when asked.",2025-04-20,3
4,2,NATURAL HIGH  (J365),P N Wong,B,"Settled in front of midfield, raced wide from 800M, ran on evenly (Lost left front plate).",2025-04-20,3
5,9,AUTUMN DELIGHT  (J090),B Avdulla,TT,"Settled midfield, responded reasonably well when placed under pressure.",2025-04-20,3
6,4,JOLLY COMPANION  (H454),M F Poon,CP/TT,"Sat handy, traveled smoothly, slightly weakened inside 200M.",2025-04-20,3
7,10,CALIFORNIA STAR  (J123),Y L Chung,B/TT,"Very slow to begin, sat rear, made some ground when asked (Must Stalls Test).",2025-04-20,3
8,6,SUGAR QUEEN PRAWN  (K149),L Hewitson,H1/SR1/XB1,"Sat towards rear, one pace to the finish (See Incident Report).",2025-04-20,3
9,3,CANDLELIGHT DINNER  (J468),M L Yeung,H,"Shared the lead, traveled okay, very limited when asked in the Straight.",2025-04-20,3
10,7,GOLDEN FRIENDSHIP  (K106),L Ferraris,CP/TT,"Settled midfield, traveled fairly, not much impression made (Noted to be lame in its right front leg on the next day, See Incident Report).",2025-04-20,3
11,12,YEAH BUDDY  (J430),K C Leung,TT,"Sat handy, gave ground quickly passing 200M (Substantial blood in trachea).",2025-04-20,3
12,5,HANDSOME BLOND  (K241),B Thompson,SR1/TT1,"Jumped only fairly, settled in front of midfield, never a threat.",2025-04-20,3
1,6,BRIGHT INHERITANCE  (J215),L Ferraris,B/SR1/TT-,"Slowly into stride, recovered to race mid-field, good headway up rail from 400m out, chased leader, led 100m out.",2025-04-20,4
2,14,HAPPY UNIVERSE  (J533),H Bentley,P,"Tracked pace, driven to challenge 200m out, every chance but held by winner final 100m.",2025-04-20,4
3,1,ETALON OR  (J273),A Badel,B,"Held up in last pair, taken wide off bend, stayed on well final 200m, closed on first two final 75m.",2025-04-20,4
4,12,DOUBLE WIN  (H382),M Chadwick,XB/B1/TT,"Mid-field, under pressure over 200m out, stayed on, closed on leaders final 50m.",2025-04-20,4
5,4,MISTER DAPPER  (H376),B Avdulla,B/XB/TT,"Kept wide early, across and upsides leader by halfway, led 550m out, kicked three lengths clear entering home straight, headed 100m out and no extra.",2025-04-20,4
6,8,FORTUNE BOY  (K098),K Teetan,CP1,"Waited with towards rear, wide off final bend, steady headway until no further impression final 50m.",2025-04-20,4
7,10,THE AUSPICIOUS  (K004),M L Yeung,H,"Held up, keen early, pushed along when hampered against rail 300m out, one paced after.",2025-04-20,4
8,7,SILVER UP  (J078),A Atzeni,B/TT-,"Towards rear of mid-field, under pressure 400m out, no real impression.",2025-04-20,4
9,2,BEAUTY LIVE  (G057),Y L Chung,V2/TT,"Tracked leading pair, weakened 200m out.",2025-04-20,4
10,13,DRAGON SUNRISE  (J269),L Hewitson,--,"Waited with towards rear, short of room between 400m out and 300m out, hung right when clear and no impression.",2025-04-20,4
11,11,GALE SAGA  (J152),J Orman,B/TT1,"Dropped in from high draw and waited with, hampered and snatched up 300m out, no impression after.",2025-04-20,4
12,5,BLUE BARON  (J448),K C Leung,XB/TT,"In touch with leaders, pushed along final bend, weakened 300m out.",2025-04-20,4
13,3,HE WAS ME  (J535),M F Poon,V/TT,"Led, joined halfway, in second as leader quickened off final bend, weakened.",2025-04-20,4
14,9,RAGING RAPIDS  (J228),B Thompson,TT,"Three wide in mid-field, under pressure over 500m out, weakened.",2025-04-20,4
1,1,CHILL KAKA  (J486),Z Purton,V,"Average to begin, raced 2 wide slightly better than midfield early, dropped to midfield in the middle stages, commenced move 600M, 2 lengths back turning in, took the lead 150M, kept on well to the line and scored.",2025-04-20,5
2,11,SPANGLE FORTUNE  (G427),M F Poon,B/TT,"Away with them, sent forward to race in 2nd, 2 wide, there to turn, took the lead near 200M, headed 150M, kept on well to the line.",2025-04-20,5
3,4,FOREVER FOLKS  (G463),B Thompson,--,"Slightly slow out and crowded, raced behind midfield on the inside, angled out near 550M, 3 to 4 lengths back turning in, made good progress in straight to take a place, nearest finish.",2025-04-20,5
4,13,LUCKY IMPACT  (J337),M Chadwick,--,"Taken back to race 2 wide behind midfield, steadied near 1100M and 750M, 6 lengths back turning in, made very good progress in straight to make frame, nearest on line.",2025-04-20,5
5,3,FASHION LEGEND  (J080),A Atzeni,--,"Began well, trapped 4 wide with no cover, 1 to 2Ls back, found cover after entering the back straight, positioned 2 wide, 3 lengths back from 1000M, commenced move 550M, made good progress early in straight, no extra final 100M.",2025-04-20,5
6,9,VIVA CHALEUR  (G368),A Badel,H/PC2/TT,"Taken back from a wide draw, raced at rear on the outside, moved closer after passing 750M, 3 lengths back on turn, very wide into straight, kept on evenly in the run home.",2025-04-20,5
7,8,RUN RUN TIMING  (H403),H Bentley,TT,"Jumped well from gate 1, positioned 2 lengths behind the leader on the inside, moved a bit closer along the rail on turn, kept on well early in straight, peaked 200M, ran on evenly to the line.",2025-04-20,5
8,2,PRECISION GOAL  (H016),L Ferraris,BO1/TT,"Began well, sent forward to take the lead, led by 1/2L turning in, kept on well early in straight, peaked and headed 200M, weakened final 100M. (See Racing Incidents.)",2025-04-20,5
9,14,YOUNG HORIZON  (G272),M L Yeung,CP-/H2,"Began awkwardly, raced in midfield on the inside, saved ground on turn, showed some response early in straight, one-paced final furlong.",2025-04-20,5
10,6,ALL ARE MINE  (H293),K C Leung,H/TT,"Taken back from the widest draw, raced at tail, 10 lengths back, improved along the rail on turn, made some progress early in straight, no clear run 150M.",2025-04-20,5
11,10,LUCKY BANNER  (G354),E C W Wong,TT,"Out with rest, raced 3 wide, a length or so back, 2 wide from 1000M, 1 to 2 lengths back in the middle stages, hard ridden approaching 400M but only showed limited response, weakened gradually inside final furlong.",2025-04-20,5
12,5,VULCANUS  (J150),K Teetan,--,"Taken back from a wide draw, difficult to settle in the early stages, raced towards rear on the inside, angled out near 500M, 5 lengths back turning in, peaked early in straight, weakened final furlong.",2025-04-20,5
13,12,PHANTOM CYCLONE  (J271),Y L Chung,B/TT,"Shifted in at start and bumped, raced 2 wide towards rear, 3 wide from 700M, 7 lengths back turning in, failed to close off in straight.",2025-04-20,5
14,7,GALLANT CROWN  (D359),P N Wong,B-/P1/TT,"Fast into stride, raced 2 wide slightly behind midfield, unable to maintain position 700M, 7 lengths back turning in, showed nothing in straight.",2025-04-20,5
1,10,CALIFORNIATOTALITY  (H418),A Badel,B/TT,"Settled in front of midfield 2 wide, closed off nicely, just got there on the line.",2025-04-20,6
2,8,STEPS AHEAD  (J263),L Hewitson,--,"Sat behind the leaders, kept on nicely, just missed.",2025-04-20,6
3,11,PRAY FOR MIR  (J245),M Chadwick,CP,"Tracked leader, kept on well, weakened final few strides.",2025-04-20,6
4,7,BUNDLE AWARD  (K020),Z Purton,E,"Missed the start, settled towards the rear, stayed on. (See Incident report)",2025-04-20,6
5,2,HELENE FEELING  (H215),H Bentley,B/TT,"Settled midfield 2 wide, closed off fairly.",2025-04-20,6
6,9,BRAVEHEARTS  (H389),M F Poon,--,"Settled worse than midfield 2 wide, made little impression.",2025-04-20,6
7,5,WINNING DRAGON  (E461),B Avdulla,TT,"Settled midfield on the rail, one pace when asked.",2025-04-20,6
8,1,FIVE G PATCH  (G286),J Orman,TT,"Sat last, only able to picked off weakened rivals.",2025-04-20,6
9,6,C P BRAVE  (E306),A Atzeni,V,"Settled at the rear, made no impression.",2025-04-20,6
10,4,VOYAGE SAMURAI  (J026),K C Leung,B,"Jumped nicely and led, weakened in the Straight. (See Incident report)",2025-04-20,6
11,3,LA CITY BLANCHE  (G371),K Teetan,TT,"Settled behind midfield on the rail, never a threat.",2025-04-20,6
1,4,BOTTOMUPTOGETHER  (J316),Z Purton,TT,"Soon took up running setting a steady pace, drew clear inside final 300M for a convincing victory.",2025-04-20,7
2,6,SING DRAGON  (J141),M Chadwick,--,"Close up early gradually settling one-out-one-back, improved to 2nd shortly after straightening but never able to trouble the winner.",2025-04-20,7
3,2,BEAUTY WAVES  (H294),A Badel,E/P1/TT,"Settled in 5th some 3L off the pace, shifted 4-wide without cover rounding home bend, kept on steadily without quickening for a place in the run to the line.",2025-04-20,7
4,5,SELF IMPROVEMENT  (H337),P N Wong,B/TT,"Broke well from the one draw settling one back on rail in 3rd, unable to quicken under pressure in straight.",2025-04-20,7
5,3,CAPITAL DELIGHT  (H262),B Avdulla,B/TT,"Travelled in rear after sluggish start, made steady headway 3-wide rounding home bend and wider into straight, fought on steadily in the centre of the straight, never nearer.",2025-04-20,7
6,8,BUNDLE OF CHARM  (G213),K Teetan,P2,"Settled at the back from the widest draw, trailed the field to the 600M, gained within 3L of pace sharing 6th into straight, kept on steadily without threatening.",2025-04-20,7
7,9,STELLAR EXPRESS  (J186),A Atzeni,B-/PC1,"Jumped awkwardly losing ground but soon recovered along the rail to 7th some 4L off the pace, saved ground on the rail turning in for home, made no further impression.",2025-04-20,7
8,7,SUPERB CAPITALIST  (H092),Y L Chung,H/TT,"Niggled along but gradually settled wide without cover just behind midfield, dropped to tail-end rounding home bend and never seen with a chance thereafter.",2025-04-20,7
9,1,COPARTNER PRANCE  (H408),J Orman,XB,"Broke well travelling wide with the leaders, shifted one back 2-wide coming onto first bend, folded up quickly after straightening.",2025-04-20,7
1,3,MUST GO  (J133),A Atzeni,E/PC/TT,"Away in line, settled down 3-wide in midfield, hard driven from top of straight, did best work final 250M, just prevailed in a 3-way photo.",2025-04-20,8
2,1,GUMMY GUMMY  (H089),Z Purton,B,"Went forward pressing leader on outside, quickened to a commanding lead passing 200M, all out final stages and was just denied in a desperately close finish.",2025-04-20,8
3,6,DRAGON AIR FORCE  (J279),M Chadwick,TT,"Dropped back from wide draw, held up in last until passing 700M, still had over 5Ls to make up on leader 400M, closed off fastest and was just denied in a 3-way photo.",2025-04-20,8
4,12,MR ENERGIA  (J239),M F Poon,B,"Blundered on jumping and became unbalanced, obtained a midfield position on settling, 3.5L to make up 400M, kept on well to the line to be beaten 0.5L only.",2025-04-20,8
5,9,MOJAVE DESERT  (J330),K Teetan,CP/XB,"Reserved behind midfield, saved ground on inside throughout, made headway from 300M, briefly held up 150M before running on well towards the line beaten less than 1L.",2025-04-20,8
6,2,MASK RIDER  (K169),P N Wong,TT,"From draw 9 moved up to chase leaders under 10lb claimer, caught wide no cover throughout, fought hard to stay in contention, run ended 150M and faded towards the finish.",2025-04-20,8
7,10,GALAXY WITNESS  (G110),H Bentley,B/TT,"From draw 1 stayed close enough to leaders in the run to the home straight, fought hard but couldn't muster the pace to challenge leaders over final 300M.",2025-04-20,8
8,5,MASTER CHAMPION  (K266),H T Mo,TT1,"Pressed along after the start to be tracking leaders, fought on one paced on early straight, was already out of contention when steadied 50M losing momentum.",2025-04-20,8
9,4,SUPER FORTUNE  (G065),B Avdulla,TT,"Quickly into stride, shared lead on inside setting a steady pace to the home straight, lost lead nearing 200M, weakened and swamped by rivals late stages.",2025-04-20,8
10,11,G LINER  (H072),Y L Chung,H/P/XB/TT,"Jumped awkwardly, lacked early pace and ended up near last, came under pressure home turn and failed to make any progress in the straight.",2025-04-20,8
11,8,GENIUS BABY  (K132),K C Leung,--,"Dropped back from wide draw, towards the rear early stages before shifting back to last entering home turn, plenty to do 400M but failed to respond.",2025-04-20,8
12,7,GAZELEY  (K253),L Hewitson,--,"Jumped fairly from draw 12, taken back to second half of the field, struggled to keep up 600M, soon ended up in last and out of contention.",2025-04-20,8
1,10,MODULECONSTRUCTION  (H127),L Hewitson,TT,"Began well from a wide draw, raced in 2nd, 2 wide, challenged the leader turning in, took the lead approaching 300M, kept on well to hold off the challengers.",2025-04-20,9
2,8,SUPER INFINITY  (J320),H Bentley,CP-/B1,"Made contact shortly after start, raced 2 wide in midfield, 3 lengths or so back, there to turn, closed off well to take 2nd, nearest on line.",2025-04-20,9
3,3,AERIS NOVA  (J534),K C Leung,V/XB/TT,"Out with rest, raced behind midfield on the inside, saved ground on turn, no clear run early in straight, cleared 300M, finished off well to take a place.",2025-04-20,9
4,11,BLAZING WIND  (J157),M Chadwick,CP/TT,"Away well, raced 2 wide, 1-1/2L back, same position on turn, hard ridden after passing 300M, kept on well to the line but always held.",2025-04-20,9
5,4,PAKISTAN LEGACY  (J363),Z Purton,CP/TT,"Began well from a wide draw, taken back to race 3 wide behind midfield, 4 lengths back, there to turn, made some progress in straight.",2025-04-20,9
6,9,MAJESTIC EXPRESS  (J244),B Avdulla,E,"Taken back to race 2 wide behind midfield, 4 lengths back turning in, no clear run early in straight, found daylight approaching 250M, finished off evenly.",2025-04-20,9
7,12,MEOWTH  (J487),K Teetan,CP/TT,"Began only fairly from gate 12, taken back to race towards rear on the outside, 6 lengths back turning in, made some headway in straight.",2025-04-20,9
8,6,ALL ROUND WINNER  (K382),A Atzeni,--,"Jumped only fairly, raced at tail, 6 lengths or so back, same margin back on turn, passed some tired runners in straight.",2025-04-20,9
9,2,TRIUMPHANT MORE  (J489),A Badel,B,"Jumped with them, raced in midfield on the outside, no cover for the majority of the race, showed some response early in straight, peaked 200M, weakened final 150M. (See Racing Incidents.)",2025-04-20,9
10,1,YOUNG SUPERSTAR  (J400),Y L Chung,TT,"Average to begin, sent forward to take the lead, challenged by rival turning in, peaked and headed approaching 300M, weakened final furlong.",2025-04-20,9
11,5,WAVE GARDEN  (K209),L Ferraris,CP,"Moderately away, positioned a length behind the leader on rail, saved ground on turn, peaked early in straight, weakened final 250M.",2025-04-20,9
12,7,CHEVAL VICTORIOUS  (J458),J Orman,XB/CP1,"Made contact shortly after start, raced in midfield on the inside, saved ground on turn, showed no response early in straight, weakened final 300M.",2025-04-20,9
1,11,SOUTH STAR  (K153),A Atzeni,TT,"Commenced well, raced 2 wide slightly better than midfield, 2-1/2L back turning in, finished off very strongly to score.",2025-04-20,10
2,1,JUNEAU PRIDE  (J443),B Avdulla,--,"Bumped start, raced in 2nd, 2 wide, allowed rival to cross near 900M, 1 out 1 back on turn, hit the front 250M, kept on well but unable to hold off the winner close home.",2025-04-20,10
3,7,STELLAR SWIFT  (J139),H Bentley,B/TT,"Began well from gate 1, raced slightly behind midfield on the inside, 2 wide after passing 550M, 3 lengths or so back turning in, no clear run early in straight, cleared 250M, finished off well to take place.",2025-04-20,10
4,2,ANOTHER WORLD  (K005),Z Purton,CP,"Began only fairly, raced 2 wide in midfield, angled out approaching 500M, 3 lengths back turning in, hard ridden after passing 350M and made some progress.",2025-04-20,10
5,13,SUGAR BALL  (H394),M F Poon,TT,"Jumped well, raced better than midfield on the inside early, dropped to midfield 900M, saved ground on turn, made some progress in straight.",2025-04-20,10
6,8,TARGET AUDIENCE  (K107),A Badel,--,"Began awkwardly, made contact with the right side of its barrier and lost ground, raced towards rear on the inside, saved ground on turn, made good progress early in straight, peaked 100M, ran on evenly to the line.",2025-04-20,10
7,4,BEAUTY CRESCENT  (H334),J Orman,TT,"Taken back to race behind midfield on the outside, 4-1/2L back turning in, finished off evenly.",2025-04-20,10
8,5,MEGA FORCE  (K200),K C Leung,H-,"Taken back from gate 13, raced at rear on the outside, 6 lengths back on turn, made some progress in the run home.",2025-04-20,10
9,12,CALL ME GORGEOUS  (K091),M Chadwick,--,"Began well from a wide draw, raced better than midfield on the outside, 2 lengths or so back, no cover on turn, peaked early in straight, weakened gradually final furlong.",2025-04-20,10
10,6,RAGGA BOMB  (K162),A Hamelin,XB,"Shifted in at start and made contact, taken back to race at tail, 6 lengths or so back turning in, kept on same pace in straight.",2025-04-20,10
11,9,BRIGHT DAY  (J530),P N Wong,CP/TT,"Moderately away, raced better than midfield on outer early, sent forward after passing 1100M, shared lead in the middle stages, peaked and headed 250M, weakened final furlong.",2025-04-20,10
12,3,ABSOLUTE HONOUR  (K260),Y L Chung,TT,"Jumped only fairly, raced 2 wide behind midfield, angled out 450M, made no impression in straight.",2025-04-20,10
13,10,NEW FOREST  (K094),L Hewitson,TT,"Fast into stride, sent forward to take the lead, shared lead on turn, peaked and headed 250M, weakened final furlong. (See Racing Incidents.)",2025-04-20,10
Comments on Running is not available for this race.,Comments on Running is not available for this race.,Comments on Running is not available for this race.,Comments on Running is not available for this race.,Comments on Running is not available for this race.,Comments on Running is not available for this race.,2025-04-20,11
Comments on Running is not available for this race.,Comments on Running is not available for this race.,Comments on Running is not available for this race.,Comments on Running is not available for this race.,Comments on Running is not available for this race.,Comments on Running is not available for this race.,2025-04-20,12
Comments on Running is not available for this race.,Comments on Running is not available for this race.,Comments on Running is not available for this race.,Comments on Running is not available for this race.,Comments on Running is not available for this race.,Comments on Running is not available for this race.,2025-04-20,13
1,10,WINNING HEART  (H065),A Badel,B/TT,"Moderately away from gate 12, raced 3 wide with no cover, 4 lengths back, very wide into straight, finished off very strongly to score.",2025-04-23,1
2,12,MULTIDARLING  (H148),A Hamelin,CP2/TT,"Crowded shortly after start, raced 2 wide behind midfield, 5 lengths back turning in, finished off well to take 2nd.",2025-04-23,1
3,1,GIMME FIVE  (J099),K Teetan,B,"Bumped shortly after start, raced 2 wide in midfield, angled out approaching 350M, closed off well to take a place.",2025-04-23,1
4,8,HOSS  (H055),Z Purton,B/XB/TT,"Jumped only fairly, raced at rear on the inside, saved ground on turn, made good progress in straight to make frame without threatening.",2025-04-23,1
5,9,WOOD ON FIRE  (C460),M L Yeung,B-/V2/TT,"Fast into stride, raced 2 wide better than midfield, there to turn, showed good response early in straight, led briefly 150M, peaked and headed 75M, weakened thereafter.",2025-04-23,1
6,4,LUCKY GENERATIONS  (J338),B Avdulla,H/P/TT,"Moderately away, raced 3 wide with cover towards rear, very wide turning in, made good progress in straight without threatening.",2025-04-23,1
7,2,BRAVE OF FRIENDS  (J382),J Orman,CP/XB,"Made contact at start, taken back to race 2 wide at rear, 6 lengths or so back, same margin back on turn, made some headway in straight.",2025-04-23,1
8,7,SPEEDY FORTUNE  (H097),M F Poon,P-/CP2/TT,"Away with them, sent forward to take the lead, led by a length turning in, peaked and headed 150M, weakened final 75M. (See Racing Incidents.)",2025-04-23,1
9,6,JOYFUL LIFE  (H426),K C Leung,XB1/B2/TT,"Bumped on the hindquarters on jumping, sent forward to race prominently on the outside, a length or so back turning in, kept on well early in straight, peaked 150M, weakened final 100M.",2025-04-23,1
10,3,GLORIOUS EXPERT  (J028),L Ferraris,P,"Jumped with them, positioned 1 to 2 lengths behind the leader on the inside, saved ground on turn, no clear run early in straight, weakened final 150M.",2025-04-23,1
11,5,ISLAND GOLDEN  (H018),H Bowman,B-/TT,"Commenced well, raced in midfield on the inside, saved ground on turn, showed limited response early in straight, weakened final furlong. (Blood in trachea.) (See Racing Incidents.)",2025-04-23,1
