Placing,Horse No,Horse Name,Jockey,Gear,Comment,Date,RaceNumber
8,7,ENDEARED  (H161),A Atzeni,XB,Wide into home straight after racing in rear. Some headway from 400m line but run flattened out.,2025-01-31,11
9,5,KING OF FIGHTERS  (K174),B Avdulla,TT,Across from wide draw to press leader. Weakened 200m out.,2025-01-31,11
10,8,SOLID CAR  (K058),K Teetan,--,Pushed along in mid-field from 400m out and little impression.,2025-01-31,11
11,12,THE ABSOLUTE  (H438),H Bentley,CP/XB/TT,Raced wide in rear and never a factor.,2025-01-31,11
12,1,SEASONS WIT  (H223),C Soumillon,B/TT,Held up. Some headway up rail from 400m out but run had flattened out when running out of room final 100m.,2025-01-31,11
13,2,KAHOLO ANGEL  (H216),E C W Wong,TT,Keen in wide position and headway to chase leaders at halfway. Dropped back through field from 300m out.,2025-01-31,11
14,14,LUCKY COMBINATION  (J512),A Badel,B/TT1,Under pressure in mid-field from 500m out and soon weakened.,2025-01-31,11
Comments on Running is not available for this race.,Comments on Running is not available for this race.,Comments on Running is not available for this race.,Comments on Running is not available for this race.,Comments on Running is not available for this race.,Comments on Running is not available for this race.,2025-01-31,12
Comments on Running is not available for this race.,Comments on Running is not available for this race.,Comments on Running is not available for this race.,Comments on Running is not available for this race.,Comments on Running is not available for this race.,Comments on Running is not available for this race.,2025-01-31,13
1,4,CONFRINGO  (J322),H Bentley,V/TT,"Began well from gate 1, raced in midfield on the inside, 2 wide from 600M, 2-1/2L back turning in, no clear run early in straight, cleared 150M, finished off strongly to score.",2025-02-05,1
2,8,PODIUM  (H173),M F Poon,TT,"Average to begin, raced slightly behind midfield on the inside, 2 wide after passing 850M, angled out 400M, very wide into straight, finished off strongly to take 2nd, just beaten by a narrow margin.",2025-02-05,1
3,5,GALLANT CROWN  (D359),E C W Wong,B/TT,"Jumped well from the widest draw, sent forward to take the lead, led by 1/2L turning in, kept on well in straight but unable to hold off the first two close home.",2025-02-05,1
4,11,SUPERB MOVE  (G304),K Teetan,P-/B2/TT,"Away with them, raced in 2nd early, 2 wide, allowed rival to cross 900M, sat 1-1/2L behind the leader in the middle stages, found rail approaching 650M, saved ground on turn, kept on well in straight to make frame.",2025-02-05,1
5,1,SMASHING EXPRESS  (J252),H Bowman,E,"Shifted in at start and made contact, raced 2 wide behind midfield, 3 wide from 600M, closer on turn, very wide into straight, made some progress early in straight, peaked 100M, ran on evenly to the line.",2025-02-05,1
6,2,SUPER BABY  (G364),Z Purton,TT,"Began well, raced 2 wide better than midfield, commenced move after passing 550M, 3 wide turning in, showed limited response early in straight, weakened gradually final 50M. (See Racing Incidents.)",2025-02-05,1
7,6,MR GOOD VIBES  (H180),A Badel,V,"Made contact shortly after start, raced towards rear on the inside, saved ground on turn, taken wide in straight and made some progress.",2025-02-05,1
8,9,MR ALADDIN  (H386),A Atzeni,V-/B2/TT,"Out with rest, raced better than midfield on the outside, moved closer after passing 1150M, 2nd in the middle stages, peaked early in straight, kept on same pace to the line.",2025-02-05,1
9,10,RUNNING AHEAD  (G313),L Hewitson,--,"Moderately away, raced towards rear on the outside, sent forward after passing 700M, a length back turning in, peaked early in straight, weakened gradually final 100M. (Bled.) (Lame right front leg next day.)",2025-02-05,1
10,7,YOU'REMYEVERYTHING  (E413),K H Chan,--,"Jumped well, raced better than midfield on the inside, dropped towards rear 650M, 3 lengths back turning in, showed limited response early in straight, eased final 100M. (See Racing Incidents.) (Blood in trachea.)",2025-02-05,1
11,3,PARTY WARRIOR  (E368),K De Melo,TT,"Jumped awkwardly and made contact, raced at rear, 8 lengths or so back, a bit closer after passing 600M, very wide into straight, made no impression in the run home.",2025-02-05,1
12,12,RED MAVERICK  (J067),M Chadwick,TT2,"Jumped only fairly, positioned 2 wide in midfield, commenced move after passing 600M, very wide turning in, peaked early in straight, weakened thereafter.",2025-02-05,1
1,2,HAYDAY  (H321),M F Poon,--,"Fast away but soon restrained to race ahead of midfield, closed off well after moving into clear 300M, led nearing 100M and gamely held off runner up in a driving finish.",2025-02-05,2
2,9,SUPER SIXTY  (J071),A Badel,H/P,"Jumped fairly then taken across behind runners, settled in mid-division 4Ls off pace, closed off fairly well from top of straight but was always held by winner final 100M.",2025-02-05,2
3,1,MOTOMAN  (J436),A Atzeni,PC/TT,"Away in line, chased leaders along the 2-path, poised to strike 400M, quickened to lead mid-straight but couldn't hold off first two closing stages.",2025-02-05,2
4,4,EXCELLENT PEERS  (G033),B Avdulla,CP/XB,"Jumped fairly, obtained a position behind midfield, swung wide passing 400M, kept on steadily to take 4th.",2025-02-05,2
5,10,TELECOM POWER  (J332),K Teetan,B,"Taken back to a rearward position, swung widest for home and had plenty to do top of straight, stayed on well and just missed out on the 4th spot.",2025-02-05,2
6,3,INNO CENTURY  (K113),C Y Ho,--,"Jumped on terms, settled down in mid-division 3-4Ls back, swung wide for home before closing off the race fairly.",2025-02-05,2
7,12,ORIENTAL TYCOON  (J112),Y L Chung,PC-/V1,"From draw 1 maintained a position ahead of midfield, close enough to leaders at 400M, kept on same pace in the straight. Never looked likely.",2025-02-05,2
8,7,SOLAR RIVER  (J308),C L Chau,CP/TT,"Caught wide after jumping from draw 10, pressed forward and eventually joined leader on outside, battled on one paced early straight, no extra final 200M.",2025-02-05,2
9,11,WISDOM STAR  (J351),K De Melo,B-/V1/TT,"From wide draw taken back to last, about 8Ls to make up 400M, ran past well beaten horses only.",2025-02-05,2
10,5,ACCOLADE START  (H331),H Bentley,B/XB/TT,"Away well, soon restrained to race towards the rear, wide into straight and failed to run on final 300M.",2025-02-05,2
11,6,COLONEL  (D090),L Ferraris,B,"Briefly led passing 1000M then allowed rivals to cross when the pace was inside standard, couldn't go on passing 300M, soon weakened. (Jockey : his horse races best when being able to dictate the lead.)",2025-02-05,2
12,8,SPICY KNUCKLES  (H463),M Chadwick,H-/CP/TT,"Raced keenly in the early stages, pressed forward to cross runners to his inside to avoid racing wide, held slim lead entering straight, soon no extra and dropped out to finish last.",2025-02-05,2
1,10,GLORY B  (H373),L Hewitson,CP,"Bumped at the start, sat in front of midfield, traveled comfortably, switched out rounding the Turn, responded nicely to win.",2025-02-05,3
2,9,GOOD PROSPECT  (J406),A Atzeni,H/CP1/XB2,"Settled worse than midfield, traveled strongly, held up near the 250M, lay in under pressure.",2025-02-05,3
3,6,GREAT SPIRIT  (J155),M F Poon,CP1,"Sat behind midfield, under pressure from 500, held up near 200M, ran on nicely.",2025-02-05,3
4,1,SKY JEWELLERY  (K032),H Bowman,--,"Sat towards rear, badly held up entering the Straight, finished off reasonably well (See Incident Report).",2025-02-05,3
5,11,THE PRIME  (J352),M L Yeung,B/TT,"Sat rear, traveled fairly, ran on evenly.",2025-02-05,3
6,5,BITS SUPERSTAR  (J362),C L Chau,PC,"Sat in front of midfield, raced wide from 600M, one pace to the finish.",2025-02-05,3
7,7,SUPER CHARIZZARD  (J184),L Ferraris,PC,"Chased the leader, crossed the lead from 550M and raced on the rail, gave ground notably in the Straight (See Incident Report).",2025-02-05,3
8,12,ISLAND GOLDEN  (H018),H T Mo,TT,"Jumped only fairly, sat towards rear, no impression made.",2025-02-05,3
9,4,TAIHANG SCENERY  (J314),H Bentley,H/TT,"Bumped at the start, sat behind the lead, hung in under pressure, did not finish off (See Incident Report).",2025-02-05,3
10,2,MEGA BONUS  (E184),K Teetan,--,"Ridden hard to lead until 800M, weakened making the Turn, gave ground quickly.",2025-02-05,3
11,8,COSMO NAVIGATOR  (H156),A Hamelin,B,"Sat midfield, race keenly throughout, failed to respond in the Straight.",2025-02-05,3
12,3,PRIME MORTAR  (G328),Y L Chung,V/TT,"Settled midfield, raced wide and without cover throughout, weakened rounding the Turn (See Incident Report).",2025-02-05,3
1,5,MR ASCENDENCY  (G227),L Ferraris,CP/TT,"Waited with in rear. Quickened through between horses to challenge home straight and led final 50m, winning cosily.",2025-02-05,4
2,7,TELECOM FIGHTERS  (D482),K Teetan,--,Dictated pace. Two lengths clear off final turn before run down by winner final 50m.,2025-02-05,4
3,2,HELENE FEELING  (H215),H Bentley,B/TT,Raced in touch. Three wide in back straight/final bend. Stayed on home straight but lacked speed of winner.,2025-02-05,4
4,3,SENOR TOBA  (G103),A Atzeni,CP,Raced against rail throughout. Stayed on after headway from mid-field final bend but lacked speed to challenge.,2025-02-05,4
5,6,FLAMINGO TRILLION  (H192),A Badel,--,Tracked clear leader. Unable to quicken under pressure from 400m out.,2025-02-05,4
6,1,MOMENTS IN TIME  (H474),Z Purton,TT,Held up last and taken widest final bend. Stayed on home straight but never a threat to leaders.,2025-02-05,4
7,8,RED HARE KING  (H188),M Chadwick,TT,In touch in mid-field. Outpaced and lost place 400m out. Never dangerous after.,2025-02-05,4
8,4,CAPITAL DELIGHT  (H262),C Y Ho,TT,Dropped away home straight after racing in mid-field and disappointing.,2025-02-05,4
1,5,FORTUNE WHISKEY  (J153),M F Poon,B/TT,"Jumped with them, raced towards rear on the outside, commenced move approaching 400M, very wide into straight, finished off very strongly to score.",2025-02-05,5
2,2,GOLDEN RISE  (H242),Z Purton,B,"Began well from a wide draw, raced prominently on the outside, challenged the leader turning in, took the lead 300M, kept on well but unable to hold off the winner final 25M. (See Racing Incidents.)",2025-02-05,5
3,4,GALVANIC  (H147),H Bowman,TT,"Taken back from the widest draw, raced 2 wide at rear, 4 to 5 lengths back turning in, made good progress in straight to take a place.",2025-02-05,5
4,10,SWEET DIAMOND  (G063),H Bentley,TT,"Bumped on jumping, sent forward to race prominently on the inside, allowed rival to cross near 800M, sat right behind the leader in the middle stages, 2 wide from 350M, kept on well in straight to make frame without threatening.",2025-02-05,5
5,7,ACE POWER  (J181),A Atzeni,B/TT,"Taken back from a wide draw, raced at rear on the inside, 6 lengths back turning in, taken wide in straight and finished off strongly to be nearest on line.",2025-02-05,5
6,12,WORLD HERO  (J413),L Hewitson,CP-,"Began well from gate 1, raced in midfield on the inside, saved ground on turn, no clear run early in straight, ran on evenly thereafter.",2025-02-05,5
7,3,KA YING POWER  (H169),C L Chau,H/SR,"Bumped start and unbalanced, raced behind midfield on the inside, saved ground on turn, no clear run in straight, not able to test properly.",2025-02-05,5
8,1,CIRCUIT DUFFY  (J501),B Avdulla,--,"Away well, raced better than midfield on the outside, 1-1/2L back turning in, peaked on run 200M, short of room and eased close home.",2025-02-05,5
9,8,ROARING BEBE  (H105),K Teetan,CP-/XB-/B1,"Bumped start, raced 2 wide behind midfield, angled out 450M, 3-1/2L back turning in, one-paced in the run home. (Lame right front leg next day.)",2025-02-05,5
10,11,TOGEPI  (G458),M Chadwick,B/TT,"Shifted out at start and bumped, raced 2 wide in midfield, similar position on turn, failed to close off in straight.",2025-02-05,5
11,9,BULB EMPEROR  (J241),A Hamelin,B-/TT,"Away with them, raced 3 wide in midfield, no cover on turn, commenced move 450M, peaked early in straight, weakened inside final furlong.",2025-02-05,5
12,6,IRON LEGION  (J459),Y L Chung,B/TT,"Moderately away, sent forward to take the lead, found rail near 800M, challenged by rival turning in, headed 300M, weakened final furlong. (See Racing Incidents.)",2025-02-05,5
1,2,NORTHERN BEAST  (H233),Z Purton,V,"Settled midfield on the rail, angled out in the Straight, closed off nicely to score.",2025-02-05,6
2,9,DRAGON STAR  (H128),C L Chau,V/XB,"Tracked leader 2 wide, kept on well for 2nd.",2025-02-05,6
3,4,MISSION STRIKE  (J377),L Ferraris,--,"Sat behind midfield, stayed on nicely.",2025-02-05,6
4,7,AMAZING AWARD  (J236),K Teetan,CP/TT,"Settled near the rear 2 wide, switched out rounding the Home Turn, closed off okay.",2025-02-05,6
5,6,SMART CITY  (J213),M F Poon,CP/TT,"Settled in front of midfield on the rail, only one pace when asked.",2025-02-05,6
6,12,KINGLY DEMEANOR  (H486),M L Yeung,TT,"Showed good speed to lead, kept on fairly.",2025-02-05,6
7,8,FLYING SILVER  (E478),A Atzeni,TT,"Raced in front of midfield 2 wide, ran on evenly.",2025-02-05,6
8,5,INTREPID WINNER  (G144),B Thompson,B,"Settled worse than midfield 2 wide, made no impression.",2025-02-05,6
9,11,PEGASUS GENERAL  (G189),M Chadwick,B/TT,"Sat midfield 2 wide, made no ground.",2025-02-05,6
10,1,CAN'T GO WONG  (H087),C Y Ho,B/TT,"Sat last, minor headway late. (See Incident Report)",2025-02-05,6
11,10,DRAGON DELIGHT  (G395),E C W Wong,B/TT,"Sat on pace, weakened final furlong.",2025-02-05,6
12,3,TAKE ACTION  (J098),B Avdulla,H,"Settled at the rear, never a factor. (See Incident Report)",2025-02-05,6
1,4,RED ELEGANCE  (H241),H Bowman,B,"Broke well from a middle draw and soon taken back to midfield, commenced move home bend reaching 3L 4th into straight, quickened well to asset authority 50M out.",2025-02-05,7
2,3,ETERNAL FORTUNE  (K010),E C W Wong,TT,"Jumped awkwardly losing ground, recovered steadily in back straight to reach 8th some 5L back 3-wide onto home bend, responded well inside final 200M and did best work late.",2025-02-05,7
3,6,HEROIC MASTER  (G394),Z Purton,B/TT,"Began well from the widest draw and gradually taken back reaching last 700M out, checked when keen behind runners 600M out, saved ground turning into home straight, made significant progress to snatch 3rd final strides.",2025-02-05,7
4,2,YOUTHFUL SPIRITS  (J082),L Ferraris,B/SR/TT,"Ridden positively to soon take up running 3-wide, obtained rails run about 700M out, kicked some 3L clear about 150M out only to swamped closing stages.",2025-02-05,7
5,1,HEALTHY HEALTHY  (H203),C Y Ho,B/TT,"Jumped fairly and sluggish early stages, improved under pressure to joint 8th some 5L back about 600M out, baulked for a run after straightening and until the 200M, quickened well to narrowly miss a placing.",2025-02-05,7
6,11,GRAND NOVA  (J323),A Atzeni,E,"Taken well back from a poor draw, obtained rails run over 800M out, raced keenly between 650M and 500M, obtained a clear run inside the 200M near the centre of the track, did best work late.",2025-02-05,7
7,5,FUN ELITE  (J042),L Hewitson,TT,"Began well from a poor draw travelling better than midfield wide without cover, faded steadily after straightening.",2025-02-05,7
8,9,ALLGREEKTOME  (H007),B Thompson,BO-/B1/TT,"Ridden along the rail to be one back in 3rd on rail, in similar position into straight, faded steadily under pressure.",2025-02-05,7
9,10,CHEVAL VALIANT  (E336),H Bentley,B/TT,"Chased leader to straight, kept on in straight before folding up quickly inside final 100M.",2025-02-05,7
10,8,SERGEANT PEPPER  (E432),M L Yeung,CP,"Ridden along in midfield near the rail, inconvenienced behind runners about 600M out, snuck up on rail turning in for home, faded under pressure inside final 200M.",2025-02-05,7
11,7,VON BAER  (K198),C L Chau,--,"Broke well before taken back towards rear, dropped to rear 600M out, made no impression from wide into straight.",2025-02-05,7
12,12,SKY CAP  (K125),A Badel,XB/TT,"Taken back gradually from a poor draw, wide in last few rounding home bend and last into straight, made no further impression.",2025-02-05,7
1,4,SOLEIL FIGHTER  (J127),Z Purton,XB,"Led from 1400M and dictated the pace, kicked home strongly passing 300M soon opening up a comfortable lead, kept going well late and maintained that advantage to the line.",2025-02-05,8
2,6,DEFINITIVE  (K037),K Teetan,B/TT,"Chased leader in a steadily run race, all out final 300M but not going the pace to challenge leader, lost 2nd inside 200M but rallied back to re-take 2nd spot near line.",2025-02-05,8
3,7,IVY LEAGUE  (H116),L Hewitson,BO/XB/TT,"Settled down midfield 5Ls off leader, raced keenly from 750M and raced wide no cover after, hung in in the home straight, not fully tested final stages but still managed to take 3rd.",2025-02-05,8
4,3,I CAN  (H381),A Atzeni,H/TT,"Chased leaders in the 4th spot, driven passing 450M, battled on to take 4th in a close finish for the minor placings.",2025-02-05,8
5,1,LOVERO  (H451),Y L Chung,TT,"Quickly into stride, led early stages before easing back to 3rd, responded well under pressure in the straight, went 2nd inside 200M but couldn't hang on late. (Jockey : instructed to find cover.)",2025-02-05,8
6,10,QUANTUM PATCH  (H166),C Y Ho,TT,"Slow out, settled in mid-division, 3Ls off leader 400M, checked 200M losing momentum, couldn't make up ground final stages.",2025-02-05,8
7,5,GALAXY WITNESS  (G110),H Bowman,TT,"Jumped only fairly, maintained a position behind midfield, driven out 500M and came with a short-lived effort early straight, held ground final 200M. (Jockey reminded to ride out to the finish.)",2025-02-05,8
8,2,ROMANTIC LAOS  (G476),M Chadwick,CP/TT,"Jumped fairly, reserved in second half of the field 6Ls off pace, gave limited response on straightening. Never threatened.",2025-02-05,8
9,12,COMET SPLENDIDO  (G071),H Bentley,TT,"From a wide draw shifted across behind runners, raced near last 9-10Ls off pace, responded fairly passing 400M. No impression.",2025-02-05,8
10,11,GLORIOUS JOURNEY  (J137),M F Poon,TT,"Bumped on jumping, obtained a spot in midfield but raced wide no cover throughout, failed to run on from top of straight.",2025-02-05,8
11,8,SETANTA  (G095),L Ferraris,B/TT,"Taken across from wide draw, reserved near last 8-9Ls back, swung wide for home, never going the pace to challenge.",2025-02-05,8
12,9,C YEAH  (K034),M L Yeung,CP,"From a wide draw shifted across behind runners, raced as the back-marker from 1200M, struggled to go with them home turn, soon beaten top of straight.",2025-02-05,8
1,9,GALLANT VALOUR  (H323),B Avdulla,B/TT,"Jumped with them, raced 2 wide in midfield, angled out 500M, 2 lengths or so back turning in, made contact 200M, finished off strongly, led final strides.",2025-02-05,9
2,6,EASON  (G061),H Bowman,--,"Out in line, raced 2 wide behind midfield, 3 wide from 450M, not enough room early in straight, made contact 200M, closed off well to take 2nd, just beaten by a head.",2025-02-05,9
3,10,HAPPY FAT CAT  (G166),A Hamelin,TT,"Fast into stride, sent forward to take the lead, led by a length turning in, kept on well in straight but unable to hold off the first two late.",2025-02-05,9
4,8,SUPER JOY N FUN  (J164),C L Chau,XB/TT,"Commenced well, positioned 2 wide better than midfield, 3 wide from 500M, moved a bit closer on turn, kept on well in straight to make frame.",2025-02-05,9
5,7,A AMERIC TE SPECSO  (H037),A Atzeni,B,"Slowly away, raced towards rear on the inside, saved ground on turn, kept to inside after straightening and made some progress, no clear run 100M, cleared 50M, ran on well to the line.",2025-02-05,9
6,2,GUSTOSISIMO  (J303),Y L Chung,TT,"Began well from gate 1, raced better than midfield on the inside, saved ground on turn, crowded 500M, kept on well early in straight, crowded and no clear run close home.",2025-02-05,9
7,3,KYRUS DRAGON  (H396),K Teetan,H/XB,"Away with them, raced in midfield on the inside, 2 wide from 500M, unable to obtain clear run in straight.",2025-02-05,9
8,5,VIEW OF THE WORLD  (J348),Z Purton,TT,"Taken back from a wide draw, raced 3 wide with cover towards rear, commenced move 400M, 3 to 4 lengths back turning in, made little progress in straight. (See Racing Incidents.)",2025-02-05,9
9,12,HAROLD WIN  (J280),M L Yeung,B/XB,"Began only fairly from the widest draw, raced in 2nd, 2 wide, hampered near 550M, a length back turning in, peaked early in straight, weakened gradually final 100M.",2025-02-05,9
10,4,NORDIC DRAGON  (G467),C Y Ho,TT,"Taken back from a wide draw, raced at rear, 8 lengths back, closer on turn, very wide into straight, made some progress late but set an impossible task.",2025-02-05,9
11,1,WINGS OF WAR  (H162),H Bentley,B,"Average to begin, unable to slot in, raced slightly behind midfield on the outside, no cover for the majority of the race, very wide into straight, peaked early in straight, weakened thereafter. (See Racing Incidents.)",2025-02-05,9
12,11,TURF PHOENIX  (J294),K De Melo,B,"Crowded start, raced 2 wide at rear, travelled keenly in the early stages, steadied off heels 550M, found rail 400M, peaked early in straight, weakened final furlong.",2025-02-05,9
Comments on Running is not available for this race.,Comments on Running is not available for this race.,Comments on Running is not available for this race.,Comments on Running is not available for this race.,Comments on Running is not available for this race.,Comments on Running is not available for this race.,2025-02-05,10
Comments on Running is not available for this race.,Comments on Running is not available for this race.,Comments on Running is not available for this race.,Comments on Running is not available for this race.,Comments on Running is not available for this race.,Comments on Running is not available for this race.,2025-02-05,11
Comments on Running is not available for this race.,Comments on Running is not available for this race.,Comments on Running is not available for this race.,Comments on Running is not available for this race.,Comments on Running is not available for this race.,Comments on Running is not available for this race.,2025-02-05,12
Comments on Running is not available for this race.,Comments on Running is not available for this race.,Comments on Running is not available for this race.,Comments on Running is not available for this race.,Comments on Running is not available for this race.,Comments on Running is not available for this race.,2025-02-05,13
1,6,SPECIAL HEDGE  (H354),L Hewitson,V/TT,"Began awkwardly and lost ground, raced 2 wide towards rear, 6 lengths or so back, 3 wide from 700M, 4 lengths back turning in, finished off strongly to score by a neck.",2025-02-09,1
2,2,FIGHT TIME  (H409),H Bowman,B-/V1,"Moderately away from gate 1, raced slightly behind midfield on the inside, saved ground on turn, no clear run early in straight, made good progress thereafter to take 2nd.",2025-02-09,1
3,13,REGENCY HAPPY STAR  (H248),A Badel,XB/TT,"Jumped well, took the early lead, headed 1050M, sat right behind the leader in the middle stages, retook the lead 250M, kept on well but unable to hold off the first two final 25M.",2025-02-09,1
4,7,FLYING PHANTOM  (J086),B Avdulla,H-/B,"Away with them, raced in midfield on outer, 2 lengths or so back turning in, made good progress early in straight, peaked on run 150M, weakened final 50M.",2025-02-09,1
5,8,SO AWESOME  (D258),P N Wong,B/TT,"Began awkwardly, taken back to race towards rear on the inside, 2 wide from 700M, unable to obtain clear run until approaching final 100M, made some headway thereafter. (See Racing Incidents.)",2025-02-09,1
6,11,LAPRAS  (H374),L Ferraris,TT,"Began well, positioned 2 wide, 2 lengths or so back, same margin back on turn, no daylight early in straight, cleared approaching 100M, finished off evenly.",2025-02-09,1
7,14,CALIFORNIA ICON  (H404),Y L Chung,B/TT,"Jumped well from a wide draw, raced better than midfield on the outside early, took the lead 1050M, led by a length on turn, peaked and headed 250M, weakened final 100M.",2025-02-09,1
8,9,GANGNAM STAR  (H326),K Teetan,XB,"Taken back from gate 12, raced at rear on the outside, 5 to 6 lengths back turning in, made some progress in straight. (See Racing Incidents.)",2025-02-09,1
9,4,IVICTORIAM  (J226),H Bentley,TT,"Jumped with them, raced 2 wide in midfield, there to turn, no clear run early in straight, cleared 150M, ran on evenly to the line.",2025-02-09,1
10,3,THE KHAN  (H489),C Y Ho,SR-/B1,"Taken back to race behind midfield on the outside, difficult to settle in the early and middle stages, 3 lengths back turning in, showed limited response early in straight, weakened gradually inside final furlong.",2025-02-09,1
11,1,LUCKY MAN  (J315),Z Purton,BO/H,"Out in line, raced 3 wide better than midfield, 1 to 2 lengths back turning in, peaked early in straight, weakened final furlong. (See Racing Incidents.)",2025-02-09,1
12,10,WINNING TURN  (J163),H T Mo,PC/TT,"Taken back from a wide draw, raced at tail, 7 lengths back turning in, made no impression in straight.",2025-02-09,1
13,5,JOYFUL LIFE  (H426),E C W Wong,TT-,"Commenced well, raced prominently on the outside, there to turn, peaked early in straight, weakened final 200M.",2025-02-09,1
14,12,GO HERO  (H315),M F Poon,B/TT,"Average to begin, positioned 2-1/2L behind the leader, saved ground on turn, peaked early in straight, weakened thereafter.",2025-02-09,1
1,9,GALLANT EPOCH  (J451),L Hewitson,B/TT,"Ridden to soon take up running making all, driven clear over 200M out and never troubled.",2025-02-09,2
2,2,MASTER TRILLION  (J442),Z Purton,B,"Settled just over 2L off the pace in 6th, became 5th 3-wide rounding home bend, fought on under pressure to reach 2nd 150M out, just held on narrowly for the placing.",2025-02-09,2
3,7,TOP TIME  (K006),K De Melo,--,"Settled mainly just better than midfield, baulked for a run early in straight until the 200M, ran on steadily without threatening.",2025-02-09,2
